{
  "description": "From power-on (PyBoy's boot ROM, empty cartridge RAM) to Out of the Woods, day 1, after the level starts. Policy: A for 2 ticks every 60 ticks (B in the temple dialogue); on the map, wait 30, Left for 4, wait 90, A for 2; then 60 idle ticks.",
  "emulator": {
    "cgb": true,
    "name": "PyBoy",
    "sound_emulated": true,
    "version": "2.7.0"
  },
  "expect": {
    "wLevel": 0,
    "wLevelRoomID": 0,
    "wRoom": 1,
    "wState": 2,
    "wSubState": 3,
    "wWarioState": 0,
    "wWarioXPos": 56,
    "wWarioYPos": 752
  },
  "format": "wl3pc.oracle-route",
  "format_version": 2,
  "id": "ootw-day1-start",
  "input": {
    "description": "Power-on to Out of the Woods, day 1, Wario idle in ROOM_001",
    "events": [
      {
        "held": [
          "a"
        ],
        "tick": 0
      },
      {
        "held": [],
        "tick": 2
      },
      {
        "held": [
          "a"
        ],
        "tick": 60
      },
      {
        "held": [],
        "tick": 62
      },
      {
        "held": [
          "a"
        ],
        "tick": 120
      },
      {
        "held": [],
        "tick": 122
      },
      {
        "held": [
          "a"
        ],
        "tick": 180
      },
      {
        "held": [],
        "tick": 182
      },
      {
        "held": [
          "a"
        ],
        "tick": 240
      },
      {
        "held": [],
        "tick": 242
      },
      {
        "held": [
          "a"
        ],
        "tick": 300
      },
      {
        "held": [],
        "tick": 302
      },
      {
        "held": [
          "a"
        ],
        "tick": 360
      },
      {
        "held": [],
        "tick": 362
      },
      {
        "held": [
          "a"
        ],
        "tick": 420
      },
      {
        "held": [],
        "tick": 422
      },
      {
        "held": [
          "a"
        ],
        "tick": 480
      },
      {
        "held": [],
        "tick": 482
      },
      {
        "held": [
          "a"
        ],
        "tick": 540
      },
      {
        "held": [],
        "tick": 542
      },
      {
        "held": [
          "a"
        ],
        "tick": 600
      },
      {
        "held": [],
        "tick": 602
      },
      {
        "held": [
          "a"
        ],
        "tick": 660
      },
      {
        "held": [],
        "tick": 662
      },
      {
        "held": [
          "a"
        ],
        "tick": 720
      },
      {
        "held": [],
        "tick": 722
      },
      {
        "held": [
          "a"
        ],
        "tick": 780
      },
      {
        "held": [],
        "tick": 782
      },
      {
        "held": [
          "a"
        ],
        "tick": 840
      },
      {
        "held": [],
        "tick": 842
      },
      {
        "held": [
          "a"
        ],
        "tick": 900
      },
      {
        "held": [],
        "tick": 902
      },
      {
        "held": [
          "a"
        ],
        "tick": 960
      },
      {
        "held": [],
        "tick": 962
      },
      {
        "held": [
          "a"
        ],
        "tick": 1020
      },
      {
        "held": [],
        "tick": 1022
      },
      {
        "held": [
          "a"
        ],
        "tick": 1080
      },
      {
        "held": [],
        "tick": 1082
      },
      {
        "held": [
          "a"
        ],
        "tick": 1140
      },
      {
        "held": [],
        "tick": 1142
      },
      {
        "held": [
          "a"
        ],
        "tick": 1200
      },
      {
        "held": [],
        "tick": 1202
      },
      {
        "held": [
          "a"
        ],
        "tick": 1260
      },
      {
        "held": [],
        "tick": 1262
      },
      {
        "held": [
          "a"
        ],
        "tick": 1320
      },
      {
        "held": [],
        "tick": 1322
      },
      {
        "held": [
          "a"
        ],
        "tick": 1380
      },
      {
        "held": [],
        "tick": 1382
      },
      {
        "held": [
          "a"
        ],
        "tick": 1440
      },
      {
        "held": [],
        "tick": 1442
      },
      {
        "held": [
          "a"
        ],
        "tick": 1500
      },
      {
        "held": [],
        "tick": 1502
      },
      {
        "held": [
          "a"
        ],
        "tick": 1560
      },
      {
        "held": [],
        "tick": 1562
      },
      {
        "held": [
          "a"
        ],
        "tick": 1620
      },
      {
        "held": [],
        "tick": 1622
      },
      {
        "held": [
          "a"
        ],
        "tick": 1680
      },
      {
        "held": [],
        "tick": 1682
      },
      {
        "held": [
          "a"
        ],
        "tick": 1740
      },
      {
        "held": [],
        "tick": 1742
      },
      {
        "held": [
          "a"
        ],
        "tick": 1800
      },
      {
        "held": [],
        "tick": 1802
      },
      {
        "held": [
          "a"
        ],
        "tick": 1860
      },
      {
        "held": [],
        "tick": 1862
      },
      {
        "held": [
          "a"
        ],
        "tick": 1920
      },
      {
        "held": [],
        "tick": 1922
      },
      {
        "held": [
          "a"
        ],
        "tick": 1980
      },
      {
        "held": [],
        "tick": 1982
      },
      {
        "held": [
          "a"
        ],
        "tick": 2040
      },
      {
        "held": [],
        "tick": 2042
      },
      {
        "held": [
          "a"
        ],
        "tick": 2100
      },
      {
        "held": [],
        "tick": 2102
      },
      {
        "held": [
          "a"
        ],
        "tick": 2160
      },
      {
        "held": [],
        "tick": 2162
      },
      {
        "held": [
          "a"
        ],
        "tick": 2220
      },
      {
        "held": [],
        "tick": 2222
      },
      {
        "held": [
          "a"
        ],
        "tick": 2280
      },
      {
        "held": [],
        "tick": 2282
      },
      {
        "held": [
          "a"
        ],
        "tick": 2340
      },
      {
        "held": [],
        "tick": 2342
      },
      {
        "held": [
          "a"
        ],
        "tick": 2400
      },
      {
        "held": [],
        "tick": 2402
      },
      {
        "held": [
          "a"
        ],
        "tick": 2460
      },
      {
        "held": [],
        "tick": 2462
      },
      {
        "held": [
          "a"
        ],
        "tick": 2520
      },
      {
        "held": [],
        "tick": 2522
      },
      {
        "held": [
          "a"
        ],
        "tick": 2580
      },
      {
        "held": [],
        "tick": 2582
      },
      {
        "held": [
          "a"
        ],
        "tick": 2640
      },
      {
        "held": [],
        "tick": 2642
      },
      {
        "held": [
          "a"
        ],
        "tick": 2700
      },
      {
        "held": [],
        "tick": 2702
      },
      {
        "held": [
          "a"
        ],
        "tick": 2760
      },
      {
        "held": [],
        "tick": 2762
      },
      {
        "held": [
          "a"
        ],
        "tick": 2820
      },
      {
        "held": [],
        "tick": 2822
      },
      {
        "held": [
          "a"
        ],
        "tick": 2880
      },
      {
        "held": [],
        "tick": 2882
      },
      {
        "held": [
          "a"
        ],
        "tick": 2940
      },
      {
        "held": [],
        "tick": 2942
      },
      {
        "held": [
          "a"
        ],
        "tick": 3000
      },
      {
        "held": [],
        "tick": 3002
      },
      {
        "held": [
          "a"
        ],
        "tick": 3060
      },
      {
        "held": [],
        "tick": 3062
      },
      {
        "held": [
          "a"
        ],
        "tick": 3120
      },
      {
        "held": [],
        "tick": 3122
      },
      {
        "held": [
          "a"
        ],
        "tick": 3180
      },
      {
        "held": [],
        "tick": 3182
      },
      {
        "held": [
          "a"
        ],
        "tick": 3240
      },
      {
        "held": [],
        "tick": 3242
      },
      {
        "held": [
          "a"
        ],
        "tick": 3300
      },
      {
        "held": [],
        "tick": 3302
      },
      {
        "held": [
          "a"
        ],
        "tick": 3360
      },
      {
        "held": [],
        "tick": 3362
      },
      {
        "held": [
          "a"
        ],
        "tick": 3420
      },
      {
        "held": [],
        "tick": 3422
      },
      {
        "held": [
          "a"
        ],
        "tick": 3480
      },
      {
        "held": [],
        "tick": 3482
      },
      {
        "held": [
          "a"
        ],
        "tick": 3540
      },
      {
        "held": [],
        "tick": 3542
      },
      {
        "held": [
          "a"
        ],
        "tick": 3600
      },
      {
        "held": [],
        "tick": 3602
      },
      {
        "held": [
          "a"
        ],
        "tick": 3660
      },
      {
        "held": [],
        "tick": 3662
      },
      {
        "held": [
          "a"
        ],
        "tick": 3720
      },
      {
        "held": [],
        "tick": 3722
      },
      {
        "held": [
          "a"
        ],
        "tick": 3780
      },
      {
        "held": [],
        "tick": 3782
      },
      {
        "held": [
          "a"
        ],
        "tick": 3840
      },
      {
        "held": [],
        "tick": 3842
      },
      {
        "held": [
          "a"
        ],
        "tick": 3900
      },
      {
        "held": [],
        "tick": 3902
      },
      {
        "held": [
          "a"
        ],
        "tick": 3960
      },
      {
        "held": [],